Year,Link,Title,Authors,Attachment
2018,https://indico.cern.ch/event/587955/contributions/2937506/,ATLAS Analytics and Machine Learning Platforms,"Ilija Vukotic, Federica Legger, Dario Barberis, James Catmore, ",https://indico.cern.ch/event/587955/contributions/2937506/attachments/1677456/2693631/ATLAS_Analytics_and_Machine_Learning_Platforms_1.pdf
2018,https://indico.cern.ch/event/587955/contributions/2936875/,Disk failures in the EOS setup at CERN - A first systematic look at 1 year of collected data,"Dirk Duellmann, Alfonso Juan Portabales Gonzalez, Eric Bonfilou, Luis Gonzales, ",https://indico.cern.ch/event/587955/contributions/2936875/attachments/1683142/2705978/CHEP-disk-failures.pdf
2018,https://indico.cern.ch/event/587955/contributions/2937628/,Current status for simulation chain of the neutrino events in the NOvA experiment,"Adam Aurisano, Oleg Samoylov, ",https://indico.cern.ch/event/587955/contributions/2937628/attachments/1683485/2707498/NOvASim-Samoylov-CHEP2018.pdf
2018,https://indico.cern.ch/event/587955/contributions/2937507/,Continuous Analysis Preservation and Streamlining for the ATLAS Experiment,"Lukas Alexander Heinrich, Kyle Stuart Cranmer, Davide Costanzo, Borut Paul Kersevan, Attila Krasznahorkay, Kerim Suruliz, ",https://indico.cern.ch/event/587955/contributions/2937507/attachments/1679197/2697092/CHEP2018AnalysisStreamlining.pdf
2018,https://indico.cern.ch/event/587955/contributions/3012266/,Successes and trends in applying machine learning to HEP problems,"David Rousseau, ",https://indico.cern.ch/event/587955/contributions/3012266/attachments/1683944/2706920/tr1807_davidRousseau_CHEP2018_HEPML_final.pdf
2018,https://indico.cern.ch/event/587955/contributions/2937509/,Next generation generative neural networks for HEP,"Deborah BARD, Steven Andrew Farrell, Wahid Bhimji, Mustafa Mustafa, Zarija Lukic, ",https://indico.cern.ch/event/587955/contributions/2937509/attachments/1683970/2741752/CHEP2018_HEPGANs_Farrell.pdf
2018,https://indico.cern.ch/event/587955/contributions/2937529/,Synthesizing Machine Learning algorithms on FPGA,"Javier Mauricio Duarte, Song Han, Philip Coleman Harris, Edward Kreinar, Ben Kreis, Jennifer Ngadiuba, Maurizio Pierini, Nhan Viet Tran, Zhenbin Wu, ",https://indico.cern.ch/event/587955/contributions/2937529/attachments/1683932/2706842/HLS4ML_CHEP2018_Ngadiuba.pdf
2018,https://indico.cern.ch/event/587955/contributions/2937564/,Machine learning at the Cosmic Frontier,"Christopher Tunnell, ",https://indico.cern.ch/event/587955/contributions/2937564/attachments/1684208/2707652/tunnell_ml_cf.pdf
2018,https://indico.cern.ch/event/587955/contributions/2937518/,A High-Precision Tracking Algorithm for Mass Reconstruction of Heavy-Ion Fragments in the R3B Experiment at FAIR,"Dmytro Kresan, Bastian Löher, Michael Heil, ",https://indico.cern.ch/event/587955/contributions/2937518/attachments/1678227/2695233/Kresan_CHEP2018.pdf
2018,https://indico.cern.ch/event/587955/contributions/2937543/,Deep Learning applied to the Cherenkov Telescope Array data analysis,"Mikael Jacquemont, Thomas Vuillaume, Alexandre Benoit, Gilles Maurin, Patrick Lambert, Giovanni Lamanna, ",https://indico.cern.ch/event/587955/contributions/2937543/attachments/1679301/2706971/GammaLearn_CHEP2018_Vuillaume.pdf
2018,https://indico.cern.ch/event/587955/contributions/2937566/,Machine Learning Techniques in the CMS Higgs to Di-muons Search,"Dimitri Bourilkov, ",https://indico.cern.ch/event/587955/contributions/2937566/attachments/1679292/2705013/db180710.pdf
2018,https://indico.cern.ch/event/587955/contributions/2937515/,Using Generative Adversarial Networks for fast simulations in the ALICE Experiment,"Tomasz Piotr Trzcinski, Lukasz Kamil Graczykowski, Kamil Rafal Deja, ",https://indico.cern.ch/event/587955/contributions/2937515/attachments/1683183/2707645/CHEP18.pdf
2018,https://indico.cern.ch/event/587955/contributions/2937502/,The use of adversaries for optimal neural network configuration,"Anton Hawthorne-Gonzalvez, Martin Sevior, ",https://indico.cern.ch/event/587955/contributions/2937502/attachments/1682305/2707036/Sevior_CHEP_2018_Adversaries.pdf
2018,https://indico.cern.ch/event/587955/contributions/2937940/,Detection of erratic behavior in load balanced clusters of servers using a machine learning based method,"Martin Adam, Luca Magnoni, Dagmar Adamova, Martin Pilát, ",https://indico.cern.ch/event/587955/contributions/2937940/attachments/1683185/2707532/Adam-CHEP2018-Final.pdf
2018,https://indico.cern.ch/event/587955/contributions/2938074/,Performance optimization of the air shower simulation code for the Cherenkov Telescope Array,"Luisa Arrabito, Konrad Bernloehr, Johan Bregeon, Gernot Maier, Philippe Langlois, David Parello, Guillaume Revy, ",https://indico.cern.ch/event/587955/contributions/2938074/attachments/1679043/2707365/CHEP_2018_CTAOptSim_v2.pdf
2018,https://indico.cern.ch/event/587955/contributions/2937535/,Application of a Convolutional Neural Network for image classification to the analysis of collisions in High Energy Physics,"Celia Fernandez Madrazo, Ignacio Heredia Cacha, Lara Lloret Iglesias, Jesus Marco de Lucas, ",https://indico.cern.ch/event/587955/contributions/2937535/attachments/1677167/2693046/CHEP_2018_-_Ignacio_Heredia.pdf
2018,https://indico.cern.ch/event/587955/contributions/2936245/,EOSC-hub AAI: A federated authentication and authorisation infrastructure for international scientific collaboration at scale,"David Groep, Nicolas Liampotis, Paul Millar, Mischa Sallé, Hannah Short, ",https://indico.cern.ch/event/587955/contributions/2936245/attachments/1679324/2697322/EOSC-hub_AAI_-_CHEP_2018_v1.pptx
2018,https://indico.cern.ch/event/587955/contributions/2937568/,"Application of Deep Learning on Integrating Prediction, Provenance, and Optimization","Malachi Schram, Malachi Schram, Nathan Tallent, Ryan Friese, Alok Singh, ",https://indico.cern.ch/event/587955/contributions/2937568/attachments/1682099/2702777/ApplicationOfDeepLearningOnIntegratingPredictionProvenanceAndOptimization-DRAFT.pdf
2018,https://indico.cern.ch/event/587955/contributions/2937424/,"CMS Workflow Failures Recovery Panel, Towards AI-assisted Operation","Daniel Robert Abercrombie, Allison Reinsvold Hall, Paola Katherine Rozo Bernal, Jean-Roch Vlimant, Thong Nguyen, Christian Contreras Campana, Matteo Cremonesi, ",https://indico.cern.ch/event/587955/contributions/2937424/attachments/1687589/2714264/christian_contreras_chep_2018_poster.pdf
2018,https://indico.cern.ch/event/587955/contributions/2935928/,Containers usage on the ATLAS grid infrastructure,"Alessandra Forti, Andrej Filipcic, Peter Love, Paul Nilsson, Asoka De Silva, Lukas Alexander Heinrich, Tadashi Maeno, Alessandro De Salvo, ",https://indico.cern.ch/event/587955/contributions/2935928/attachments/1680775/2700354/chep2018-poster-v2.pdf
2018,https://indico.cern.ch/event/587955/contributions/2937574/,Decay Chain Reconstruction in Belle II,"Francesco Tenchini, ",https://indico.cern.ch/event/587955/contributions/2937574/attachments/1678640/2696048/CHEP_poster.pdf
2018,https://indico.cern.ch/event/587955/contributions/2935947/,Extending the Manchester site with containers and cloud technology,"Andrew McNab, Alessandra Forti, Robert Frank, ",https://indico.cern.ch/event/587955/contributions/2935947/attachments/1681948/2702489/20180709-mcnab-blackett-poster.pdf
2018,https://indico.cern.ch/event/587955/contributions/2937015/,Fair Share Scheduler for OpenNebula (FaSS): implementation and performance tests,"Sara Vallero, Valentina Zaccolo, Stefano Bagnasco, Sara Vallero, Valentina Zaccolo, ",https://indico.cern.ch/event/587955/contributions/2937015/attachments/1675246/2689372/CHEP18-Fass.pdf
2018,https://indico.cern.ch/event/587955/contributions/2936904/,Gaining insight from large data volumes with ease,"Valentin Y Kuznetsov, ",https://indico.cern.ch/event/587955/contributions/2936904/attachments/1682126/2702833/CHEP_Poster.pdf
2018,https://indico.cern.ch/event/587955/contributions/2937850/,KairosDB and Chronix as longterm storage for Prometheus - For those who don't want to deal with Hbase.,"Hristo Umaru Mohamed, Francesco Sborzacchi, Tommaso Colombo, Rainer Schwemmer, Loic Brarda, Niko Neufeld, ",https://indico.cern.ch/event/587955/contributions/2937850/attachments/1678355/2705015/chronix_kairosdb_final.pdf
2018,https://indico.cern.ch/event/587955/contributions/2937578/,Machine Learning based global particle identification algorithms at the LHCb experiment,"Donal Hill, Martino Borsato, Mikhail Hushchyn, ",https://indico.cern.ch/event/587955/contributions/2937578/attachments/1678660/2747543/PID_v6.pdf
2018,https://indico.cern.ch/event/587955/contributions/2935923/,Montoring virtual machines and containers with VacMon,"Andrew McNab, ",https://indico.cern.ch/event/587955/contributions/2935923/attachments/1681951/2702494/20180709-mcnab-vacmon-poster.pdf
2018,https://indico.cern.ch/event/587955/contributions/2937570/,Particle track building with Recurrent Neural Networks,"Paolo Calafiura, Jean-Roch Vlimant, Dustin James Anderson, Josh Bendavid, Maria Spiropulu, Prabhat, Mayur  Mudigonda, Stephan  Zheng, Giuseppe Cerati, Lindsey Gray, James Kowalkowski, Panagiotis Spentzouris, Aristeidis Tsaris, Steven Andrew Farrell, ",https://indico.cern.ch/event/587955/contributions/2937570/attachments/1682237/2703034/CHEP2018_HEPTrkX_poster.pdf
2018,https://indico.cern.ch/event/587955/contributions/2936900/,Ready to Go Data Transfers: supporting the long tail of science,"Andrea Manzi, Alejandro Alvarez Ayllon, Oliver Keeble, Maria Arsuaga Rios, Owayss Kabtoul, ",https://indico.cern.ch/event/587955/contributions/2936900/attachments/1678494/2695766/CHEP_Poster.pdf
2018,https://indico.cern.ch/event/587955/contributions/2935933/,Running Oracle WebLogic on containers,"Borja Aparicio Cotarelo, Antonio Nappi, Lukas Gedvilas, Luis Rodriguez Fernandez, Artur Wiecek, ",https://indico.cern.ch/event/587955/contributions/2935933/attachments/1680439/2699562/Oracle_Weblogic_On_Kubernetes_2018.pdf
2018,https://indico.cern.ch/event/587955/contributions/2935945/,The ComputeOps project: containers for HPC,"Cecile Cavet, Aurélien Bailly-Reyre, David Chamont, Olivier Dadoun, Pascale Hennion, Oleg Lodygensky, Gérard Marchal-Duval, Emmanuel Medernach, Victor Mendoza, Jerome Pansanel, Andrea Sartirana, Martin Souchal, Julien Tugler, ",https://indico.cern.ch/event/587955/contributions/2935945/attachments/1679547/2697753/poster_chep_18.pdf
2018,https://indico.cern.ch/event/587955/contributions/2936901/,The GridKa Tape System: monitoring and failure analysis,"Dorin Lobontu, Doris Ressmann, Martin Beitzinger, Andreas Heiss, Andreas Petzold, Karin Schaefer, ",https://indico.cern.ch/event/587955/contributions/2936901/attachments/1682811/2704148/GridKa_Tape_Monitoring_System_Poster_CHEP2018.pdf
2018,https://indico.cern.ch/event/587955/contributions/2935930/,Using Fat Containers on HPCs for the ATLAS Experiment,"Wei Yang, Doug Benjamin, Taylor Childers, David Lesny, Xin Zhao, ",https://indico.cern.ch/event/587955/contributions/2935930/attachments/1678389/2695566/Using_Containers_on_HPCs_for_the_ATLAS_Experiment_CHEP2018_poster.v3.pdf
2018,https://indico.cern.ch/event/587955/contributions/2937567/,Using Machine Learning for Precision Measurements,"Dimitri Bourilkov, ",https://indico.cern.ch/event/587955/contributions/2937567/attachments/1680180/2699071/db180709.pdf
2018,https://indico.cern.ch/event/587955/contributions/2935932/,Using the autopilot pattern to deploy container resources at a WLCG Tier-2,"Gareth Douglas Roy, David Crooks, Gordon Stewart, Samuel Cadellin Skipsey, David Britton, ",https://indico.cern.ch/event/587955/contributions/2935932/attachments/1679635/2697960/GRoy-CHEP2018.pdf
2018,https://indico.cern.ch/event/587955/contributions/2937519/,End-to-end Deep Learning Applications for Event Classification at CMS,"Michael Andrews, Manfred Paulini, Sergei Gleyzer, ",https://indico.cern.ch/event/587955/contributions/2937519/attachments/1682924/2708378/CHEP_2018JUL09_v4.pdf
2018,https://indico.cern.ch/event/587955/contributions/2937192/,Backfilling the Grid with Containerized BOINC in the ATLAS computing,"Wenjing Wu, David Cameron, Andrej Filipcic, ",https://indico.cern.ch/event/587955/contributions/2937192/attachments/1683819/2706562/Backfilling_the_Grid_with_Containerized_BOINC_in_the_ATLAS_computing.pdf
2018,https://indico.cern.ch/event/587955/contributions/2937532/,Machine learning techniques for jet flavour identification at CMS,"Mauro Verzetti, ",https://indico.cern.ch/event/587955/contributions/2937532/attachments/1679074/2708269/CHEP_2018.pdf
2018,https://indico.cern.ch/event/587955/contributions/2937503/,Application of machine learning techniques at BESIII experiment,"Beijiang Liu, ",https://indico.cern.ch/event/587955/contributions/2937503/attachments/1678297/2704637/MLatBESIII_chep2018.pdf
2018,https://indico.cern.ch/event/587955/contributions/2937206/,Serverless endpoint with public container clusters for HEP experiments,"Rafal Grzymkowski, Mateusz Sułek, ",https://indico.cern.ch/event/587955/contributions/2937206/attachments/1679629/2706601/Serverless_endpoint_CHEP2018_Grzymkowski.pdf
2018,https://indico.cern.ch/event/587955/contributions/3012566/,Blockchain for Large Scale Scientific Computing,"Josh Bendavid, Lindsey Gray, Bo Jayatilaka, Gabriel Perdue, Lothar A.T. Bauerdick, ",https://indico.cern.ch/event/587955/contributions/3012566/attachments/1684718/2709901/CHEPBlockchain_LindseyGray_12072018.pdf
2018,https://indico.cern.ch/event/587955/contributions/2937530/,Large-Scale Distributed Training of Deep Neural Net Models,"Maurizio Pierini, Felice Pantaleo, Jean-Roch Vlimant, ",
2018,https://indico.cern.ch/event/587955/contributions/2937513/,Training Generative Adversarial Models over Distributed Computing Systems,"Jean-Roch Vlimant, Sofia Vallecorsa, Federico Carminati, Maurizio Pierini, Gul Rukh Khattak, ",https://indico.cern.ch/event/587955/contributions/2937513/attachments/1685418/2710013/vlimant_CHEP-mOpt_july18.pdf
2018,https://indico.cern.ch/event/587955/contributions/2937539/,Scaling studies for deep learning in LArTPC event classification,"Jan Fridolf Strube, Malachi Schram, Eric Church, Jeff Daily, Charles Siegel, ",https://indico.cern.ch/event/587955/contributions/2937539/attachments/1684636/2710021/CHEP2018_presentation.pdf
2018,https://indico.cern.ch/event/587955/contributions/2938124/,Retroactive sustainability improvements in the MERLIN particle tracking code,"Scott Rowan, Sam Tygier, Yuanfang Cai, Colin Venters, Roger Barlow, ",https://indico.cern.ch/event/587955/contributions/2938124/attachments/1679288/2709969/CHEP18-srowan.pdf
2018,https://indico.cern.ch/event/587955/contributions/2937540/,"The HEP.TrkX project. Approaching Charged Particle Tracking at the HL-LHC with Deep Learning, for Online and Offline Processing","Dustin James Anderson, Jean-Roch Vlimant, Paolo Calafiura, Giuseppe Cerati, Steven Andrew Farrell, Lindsey Gray, James Kowalkowski, Panagiotis Spentzouris, Maria Spiropulu, Aristeidis Tsaris, Mayur  Mudigonda, Prabhat, Stephan  Zheng, ",https://indico.cern.ch/event/587955/contributions/2937540/attachments/1685043/2710034/vlimant_CHEP-HtrkX_Jul18.pdf
2018,https://indico.cern.ch/event/587955/contributions/2937545/,THE PARTICLE TRACK RECONSTRUCTION BASED ON DEEP LEARNING NEURAL NETWORKS,"Dmitriy Baranov, Gennady Ososkov, Sergey Mitsyn, Pavel Goncharov, ",https://indico.cern.ch/event/587955/contributions/2937545/attachments/1678351/2705212/G_Ososkov_CHEP-2018_9_july2018.pptx
2018,https://indico.cern.ch/event/587955/contributions/2937544/,Machine learning approaches in tracks pattern recognition for the SHiP Spectrometer Tracker,"Mikhail Hushchyn, Andrey Ustyuzhanin, Eric Van Herwijnen, ",https://indico.cern.ch/event/587955/contributions/2937544/attachments/1678658/2709924/SHiP_PatRec.pdf
2018,https://indico.cern.ch/event/587955/contributions/2935925/,Container support in Vac,"Andrew McNab, ",https://indico.cern.ch/event/587955/contributions/2935925/attachments/1681946/2710285/20180712-mcnab-vac-containers.pdf
2018,https://indico.cern.ch/event/587955/contributions/2937548/,Track Seed Filtering using Convolutional Neural Network at the CMS High Level Trigger,"Adriano Di Florio, ",https://indico.cern.ch/event/587955/contributions/2937548/attachments/1680925/2710661/CNNFiletering_CHEP2018_DiFlorio.pdf
2018,https://indico.cern.ch/event/587955/contributions/2938491/,ATLAS OpenData and OpenKey: using low tech computational tools for students training in High Energy Physics,"Arturo Sanchez Pineda, ",https://indico.cern.ch/event/587955/contributions/2938491/attachments/1635910/2689773/CHEP_2018_Arturo_Sanchez_ATLAS_Open_Data.pdf
2018,https://indico.cern.ch/event/587955/contributions/2937203/,Grid services in a box - container management in ALICE,"Maksim Melnik Storetvedt, ",https://indico.cern.ch/event/587955/contributions/2937203/attachments/1678344/2710740/CHEP_12072018.pdf
2018,https://indico.cern.ch/event/587955/contributions/2937510/,trackML :  the Kaggle HEP tracking challenge,"David Rousseau, Yetkin Yilmaz, Jean-Roch Vlimant, Isabelle Guyon, Vincenzo Innocente, Andreas Salzburger, Sabrina Amrouche, Tobias Golling, Moritz Kiehn, Paolo Calafiura, Steven Andrew Farrell, Heather Gray, Vladimir Gligorov, Cecile Germain, Mikhail Hushchyn, Andrey Ustyuzhanin, ",https://indico.cern.ch/event/587955/contributions/2937510/attachments/1683248/2705359/20180712-msmk-trackml-v3.pdf
2018,https://indico.cern.ch/event/587955/contributions/2948372/,The LHCb DIRAC containers,"Andrew McNab, ",https://indico.cern.ch/event/587955/contributions/2948372/attachments/1681953/2710286/20180712-mcnab-lhcb-containers.pdf
2018,https://indico.cern.ch/event/587955/contributions/3012312/,Summary T6 - Machine learning and physics analysis,"Sergei Gleyzer, ",https://indico.cern.ch/event/587955/contributions/3012312/attachments/1686198/2711740/CHEP_Track6_Summary_Sergei_Gleyzer.pdf
2018,https://indico.cern.ch/event/587955/contributions/3012313/,"Summary T7 - Clouds, virtualization and containers","Dave Dykstra, ",https://indico.cern.ch/event/587955/contributions/3012313/attachments/1686175/2711701/Track_7_Plenary.pdf
2016,https://indico.cern.ch/event/505613/contributions/2228322/,PODIO - Applying plain-old-data for defining physics data models,"Frank-Dieter Gaede, Pere Mato Vila, ",https://indico.cern.ch/event/505613/contributions/2228322/attachments/1348698/2034907/Highlights_100_podio.pdf
2016,https://indico.cern.ch/event/505613/contributions/2228337/,Tracking Machine Learning Challenge,"David Rousseau, Andreas Salzburger, Cecile Germain, Davide Costanzo, Isabelle Guyon, Jean-Roch Vlimant, Markus Elsing, Michael Aaron Kagan, Paolo Calafiura, Rebecca Carney, Riccardo Cenci, Steven Andrew Farrell, Tobias Golling, Tony Tong, Vincenzo Innocente, ",https://indico.cern.ch/event/505613/contributions/2228337/attachments/1348526/2039031/Highlights_237_TrackML.pdf
2016,https://indico.cern.ch/event/505613/contributions/2228359/,Neutrino Identification With A Convolutional Neural Network in the NOvA Detectors,"Adam Aurisano, Alexander Himmel, Alexander Radovic, Dominick Rocco, Evan Niner, Fernanda Psihas, ",https://indico.cern.ch/event/505613/contributions/2228359/attachments/1347716/2039478/20161010PsihasCVNtalkCHEP_16-9.pdf
2016,https://indico.cern.ch/event/505613/contributions/2228344/,New Machine Learning Developments in ROOT,"Lorenzo Moneta, Sergei Gleyzer, Omar Andres Zapata Mesa, ",https://indico.cern.ch/event/505613/contributions/2228344/attachments/1347106/2041546/oral-CHEP16-SergeiVGleyzer.pdf
2016,https://indico.cern.ch/event/505613/contributions/2230738/,Adjusting the fairshare policy to prevent computing power loss,"Stefano Dal Pra, ",https://indico.cern.ch/event/505613/contributions/2230738/attachments/1334713/2039362/Highlights-v2-516.pdf
2016,https://indico.cern.ch/event/505613/contributions/2227447/,Using container orchestration to improve service management at the RAL Tier 1,"Andrew David Lahiff, Ian Collier, ",https://indico.cern.ch/event/505613/contributions/2227447/attachments/1347485/2032477/Highlights-531.pdf
2016,https://indico.cern.ch/event/505613/contributions/2230838/,A Software Toolkit to Study Systematic Uncertainties of the Physics Models of the Geant4 Simulation Package,"Gabriel Perdue, Hans-Joachim Wenzel, Julia Yarba, Krzysztof Genser, Michael Kelsey, Robert William Hatcher, ",https://indico.cern.ch/event/505613/contributions/2230838/attachments/1347507/2038959/Highlights-278.pdf
2016,https://indico.cern.ch/event/505613/contributions/2228321/,A Comparison of Deep Learning Architectures with GPU Acceleration and Their Applications,"Jin Huang, Jin Huang, Daicui Zhou, Jianlin Zhu, ",
2016,https://indico.cern.ch/event/505613/contributions/2227234/,Reconstruction of Micropattern Detector Signals using Convolutional Neural Networks,"Lucie Flekova, Andreas Christian Dudder, Matthias Schott, ",https://indico.cern.ch/event/505613/contributions/2227234/attachments/1347570/2041446/Oral_v3_004.pdf
2016,https://indico.cern.ch/event/505613/contributions/2227269/,Online computing architecture for the CBM experiment at FAIR,"Volker Lindenstruth, ",https://indico.cern.ch/event/505613/contributions/2227269/attachments/1347343/2032976/Highlights-v0-267.pdf
2016,https://indico.cern.ch/event/505613/contributions/2227983/,A FairShare Scheduling Service for OpenNebula,"Sara Vallero, Stefano Bagnasco, ",https://indico.cern.ch/event/505613/contributions/2227983/attachments/1344751/2027307/Highlights-374.pdf
2016,https://indico.cern.ch/event/505613/contributions/2227720/,A Security Monitoring Framework For Container Based HEP Computing Infrastructures,"Andres Gomez Ramirez, Camilo Lara, Udo Wolfgang Kebschull, ",https://indico.cern.ch/event/505613/contributions/2227720/attachments/1345063/2029242/Highlights-252.pdf
2016,https://indico.cern.ch/event/505613/contributions/2228518/,Assessment of Geant4 Maintainability with respect to Software Engineering References,"Maria Grazia Pia, Elisabetta Ronchieri, Maria Grazia Pia, ",https://indico.cern.ch/event/505613/contributions/2228518/attachments/1347534/2042358/Poster-154.pdf
2016,https://indico.cern.ch/event/505613/contributions/2230741/,"Experience of Google’s latest Deep Learning library, TensorFlow,  with Docker in a WLCG cluster","Gen Kawamura, Arnulf Quadt, Gerhard Ferdinand Rzehorz, Joshua Wyatt Smith, ",https://indico.cern.ch/event/505613/contributions/2230741/attachments/1347713/2032939/CHEP2016-TensorFlow_v0.3.pdf
2016,https://indico.cern.ch/event/505613/contributions/2227714/,First experience with the new .CERN top level domain,"Andreas Wagner, Eduardo Alvarez Fernandez, Manuel Malo de Molina, Marek Salwerowicz, Bruno Silva De Sousa, Tim Smith, ",https://indico.cern.ch/event/505613/contributions/2227714/attachments/1347479/2032451/Poster-v1-034--highlights.pdf
2016,https://indico.cern.ch/event/505613/contributions/2227982/,Grid Site Availability Evaluation and Monitoring at CMS,"Gaston Lyons Pacini, Giuseppe Bagliesi, Rokas Maciulaitis, Stephan Lammel, ",https://indico.cern.ch/event/505613/contributions/2227982/attachments/1346642/2030684/highlights-359.pdf
2016,https://indico.cern.ch/event/505613/contributions/2227387/,"Integrating HPC, Cloud, and Containers for Data-Intensive Computing Platforms","Daniel Murphy-Olson, ",https://indico.cern.ch/event/505613/contributions/2227387/attachments/1347693/2032896/Highlights-560.pdf
2016,https://indico.cern.ch/event/505613/contributions/2228347/,Machine Learning with TensorFlow as an alternative to TMVA,"Martin Sevior, Aidan Dang, Anton Hawthorne, ",https://indico.cern.ch/event/505613/contributions/2228347/attachments/1346866/2045101/Oral_413_v3.pdf
2016,https://indico.cern.ch/event/505613/contributions/2227918/,Integrating Containers in the CERN Private Cloud,"Ricardo Brito Da Rocha, Bertrand Noel, Mathieu Velten, ",https://indico.cern.ch/event/505613/contributions/2227918/attachments/1346748/2041537/Highlights-2227918.pdf
2016,https://indico.cern.ch/event/505613/contributions/2227429/,Using Shifter to Bring Containerized CVMFS to HPC,"Lisa Gerhardt, Douglas Jacobsen, Jeff Porter, Shane Canon, Vakho Tsulaia, Wahid Bhimji, ",https://indico.cern.ch/event/505613/contributions/2227429/attachments/1348101/2045017/Highlight-293.pdf
2016,https://indico.cern.ch/event/505613/contributions/2227924/,Using machine learning algorithms to forecast network and system load metrics for ATLAS Distributed Computing,"Mario Lassnig, ",https://indico.cern.ch/event/505613/contributions/2227924/attachments/1346952/2031483/Highlights-131.pdf
2016,https://indico.cern.ch/event/505613/contributions/2230735/,Expanding the user base beyond HEP for the Ganga distributed analysis user interface,"Robert Andrew Currie, Ulrik Egede, Alexander John Richards, Mark Slater, Matt Williams, ",https://indico.cern.ch/event/505613/contributions/2230735/attachments/1346752/2030989/Highlights-492.pdf
2016,https://indico.cern.ch/event/505613/contributions/2230861/,Machine learning and parallelism in the reconstruction of LHCb and its upgrade,"Lucia Grillo, ",https://indico.cern.ch/event/505613/contributions/2230861/attachments/1347027/2031573/Highlights-567.pdf
2016,https://indico.cern.ch/event/505613/contributions/2228319/,Big Data Analytics for the Future Circular Collider Reliability and Availability Studies,"Andrea Apollonio, Antonio Romero Marin, Arto Niemi, Elena Rogova, Johannes Gutleber, Jussi-Pekka Penttinen, Manuel Martin Marquez, Peter Sollander, Volodimir Begy, ",https://indico.cern.ch/event/505613/contributions/2228319/attachments/1346710/2030870/Highlights-69.pdf
2016,https://indico.cern.ch/event/505613/contributions/2227937/,Index files for Belle II - very small skim containers,"Martin Sevior, Chia-Ling Hsu, Hideki Miyake, Ikuo Ueda, Takanori Hara, Thomas Kuhr, Tristan Bloomfield, ",https://indico.cern.ch/event/505613/contributions/2227937/attachments/1346865/2047097/Oral_411_v4.pdf
