Year,Link,Title,Authors,Attachment
2023,https://indico.jlab.org/event/459/contributions/11472/,Distributed Machine Learning with PanDA and iDDS in LHC ATLAS,"De Kaushik, Guan Wen, Karavakis Edward, Klimentov Alexei, Lin Fa-Hui, Maeno Tadashi, Megino Fernando Harald Barreiro, Nilsson Paul, Weber Christian, Wenaus Torre, Yang Zhaoyu, Zhang Rui, Zhao Xin, ",https://indico.jlab.org/event/459/contributions/11472/attachments/9422/13778/dml_idds_20230405%20-%20annotated%20draft%202.pptx
2023,https://indico.jlab.org/event/459/contributions/11453/,Machine learning for ambiguity resolution in ACTS,"Allaire Corentin, Grasland Hadrien, Rousseau David, Bouvet Françoise, ",https://indico.jlab.org/event/459/contributions/11453/attachments/9329/13530/Machine-learning-for-Ambiguity-Resolution-in-Acts.pdf
2023,https://indico.jlab.org/event/459/contributions/11722/,MLHad: Simulating Hadronization with Machine Learning,"Ilten Philip, Menzo Tony, Mrenna Steve, Szewc Manuel, Wilkinson Michael, Youssef Ahmed, Zupan Jure, ",https://indico.jlab.org/event/459/contributions/11722/attachments/9274/13448/MLhad%20-%20CHEP%202023.pdf
2023,https://indico.jlab.org/event/459/contributions/11715/,SYMBA: Symbolic Computation of Squared Amplitudes in High Energy Physics with Machine Learning,"Alnuqaydan Abdulhakim, Gleyzer Sergei, Prosper Harrison, ",https://indico.jlab.org/event/459/contributions/11715/attachments/9448/13700/SYMBA_CHEP23.pdf
2023,https://indico.jlab.org/event/459/contributions/11580/,Build-a-Fit: RooFit configurable parallelization and fine-grained benchmarking tools for order of magnitude speedups in your fits,"Wolffs Zef, Verkerke Wouter, Bos Patrick, van Vulpen Ivo, Brenner Lydia, ",https://indico.jlab.org/event/459/contributions/11580/attachments/9270/13480/RooFit_CHEP.pdf
2023,https://indico.jlab.org/event/459/contributions/11633/,Progress on cloud native solution of Machine Learning as Service for HEP,"Giommi Luca, Spiga Daniele, Kuznetsov Valentin, Bonacorsi Daniele, ",https://indico.jlab.org/event/459/contributions/11633/attachments/9263/13435/MLaaS4HEP.pdf
2023,https://indico.jlab.org/event/459/contributions/11672/,Training and on-boarding initiatives in HEP,"Skidmore Nicole, Lieret Kilian, Lukashenko Valeriia, David Claire, Schellman Heidi, Benelli Gabriele, Carlson Ben, Veatch Jason, Deconinck Wouter, Hernandez Villanueva Michel, Hageboeck Stephan, Reinsvold Allison, Morris Andy, Malik Sudhir, Reinsvold Hall Allison, ",https://indico.jlab.org/event/459/contributions/11672/attachments/9285/13787/HSFDAWG_Training_CHEP2023.pdf
2023,https://indico.jlab.org/event/459/contributions/11752/,Resilient Variational Autencoder for Unsupervised Anomaly Detection at the SLAC Linac Cohrerent Light Source,"Humble Ryan, Colocho William, Darve Eric, Ratner Daniel, ",https://indico.jlab.org/event/459/contributions/11752/attachments/9432/13678/CHEP%20Resilient%20VAE%205-8-22.pdf
2023,https://indico.jlab.org/event/459/contributions/11440/,Faster simulated track reconstruction in the ATLAS Fast Chain,"Leight William, Javurkova Martina, Tsai Fang-Ying, Sengupta Debajyoti, Golling Tobias, ",https://indico.jlab.org/event/459/contributions/11440/attachments/9429/13672/track%20overlay%20chep.pdf
2023,https://indico.jlab.org/event/459/contributions/11744/,Machine Learning for Etch-Pit Identification at MoEDAL,"Hays Jonathan, Millward Lewis, Upadhyay Aman, Palodhi Kanik, ",https://indico.jlab.org/event/459/contributions/11744/attachments/9392/13622/MoEDAL_ML_CHEP_2023.pdf
2023,https://indico.jlab.org/event/459/contributions/11538/,Train to Sustain,"Malik Sudhir, Lieret Kilian, Hernandez Villanueva Michel, Elmer Peter, Roiser Stefan, ",https://indico.jlab.org/event/459/contributions/11538/attachments/9476/13737/Train_to_Sustain_SudhirMalik_CHEP2023.pdf
2023,https://indico.jlab.org/event/459/contributions/11724/,Deep Learning for Amplitude Analysis in Spectroscopy,"Phelps William, Salgado Carlos, Quiroga Andru, Kolling Nathan, ",https://indico.jlab.org/event/459/contributions/11724/attachments/9419/13661/chep_pypwa_2023_phelps_v0.pdf
2023,https://indico.jlab.org/event/459/contributions/11798/,Development of particle flow algorithms based on Neural Network techniques for the IDEA calorimeter at future colliders,"DOnofrio Adelina, Di Micco Biagio, ",https://indico.jlab.org/event/459/contributions/11798/attachments/9413/13654/CHEP2023_ADOnofrio.pdf
2023,https://indico.jlab.org/event/459/contributions/11692/,Machine Learning for Columnar High Energy Physics Analysis,"Kauffman Elliott, Held Alexander, Shadura Oksana, ",https://indico.jlab.org/event/459/contributions/11692/attachments/9446/13696/ekauffma_chep2023_pdfversion.pdf
2023,https://indico.jlab.org/event/459/contributions/11723/,Machine learning based compression for scientific data,"Ekman Alexander, Gallén Axel, Ekman Alexander, Jawahar Pratik, Doglioni Caterina, ",https://indico.jlab.org/event/459/contributions/11723/attachments/9295/13647/Baler_v2.pdf
2023,https://indico.jlab.org/event/459/contributions/11670/,ML_INFN project: status report and future perspectives,"Anderlini Lucio, Boccali Tommaso, Dal Pra Stefano, Spiga Daniele, Duma Doina Cristina, Giommi Luca, ",https://indico.jlab.org/event/459/contributions/11670/attachments/9262/13434/The%20ML_INFN%20Initiative.pdf
2023,https://indico.jlab.org/event/459/contributions/11728/,Pion/Kaon Identification at STCF DTOF Based on Classical/Quantum Convolutional Neural Network,"Yao Zhipeng, Li Teng, HUANG Xingtao, ",https://indico.jlab.org/event/459/contributions/11728/attachments/9452/13841/QCNN-v2.pdf
2023,https://indico.jlab.org/event/459/contributions/11830/,Parallelization of Air Shower Simulation with IceCube,"Meagher Kevin, van Santen Jakob, ",https://indico.jlab.org/event/459/contributions/11830/attachments/9276/13450/Meagher_2023May_CHEP_Parallel_Air_Shower.pdf
2023,https://indico.jlab.org/event/459/contributions/11734/,Particle identification with machine learning in ALICE Run 3,"Kabus Maja, Jakubowska Monika, Deja Kamil, Graczykowski Łukasz, Kasak Miłosz, ",https://indico.jlab.org/event/459/contributions/11734/attachments/9290/13481/Kabus%20CHEP%20May%202023.pdf
2023,https://indico.jlab.org/event/459/contributions/11414/,Physics Performance of the ATLAS GNN4ITk Track Reconstruction Chain,"Murnane Daniel, Calafiura Paolo, Ju Xiangyang, Neubauer Mark, Caillou Sylvain, Vallier Alexis, Rougier Charline, Farrell Stephen, Atkinson Markus, ",https://indico.jlab.org/event/459/contributions/11414/attachments/9421/13699/CHEP2023%20GNN%20Performance%20for%20ITk.pdf
2023,https://indico.jlab.org/event/459/contributions/11718/,Flashsim: a ML based simulation for analysis datatiers,"Vaselli Francesco, Rizzi Andrea, ",https://indico.jlab.org/event/459/contributions/11718/attachments/9544/13848/flashsim_chep.pdf
2023,https://indico.jlab.org/event/459/contributions/11762/,FastCaloGAN: a fast simulation of the ATLAS Calorimeter with GANs,"Giannelli Michele Faucci, Young Christopher, Bandieramonte Marilena, Zhang Rui, Beirer Joshua Falco, DUEHRSSEN-DEBLING Michael, DAY-HAL Henry Ann, Salamani Dalila, Sorenson Josef, Corchia Federico, Lari Tommaso, ",https://indico.jlab.org/event/459/contributions/11762/attachments/9520/13842/FastCaloGANV2%20for%20Run3.pptx
2023,https://indico.jlab.org/event/459/contributions/11387/,Online tagging and triggering with deep learning AI for next generation particle imaging detector,"Bhattacharya Meghna, Kirby Michael, ",https://indico.jlab.org/event/459/contributions/11387/attachments/9524/13813/CHEP_2023.pdf
2023,https://indico.jlab.org/event/459/contributions/12491/,Radically different futures for HEP enabled by AI/ML,"Cranmer Kyle, ",https://indico.jlab.org/event/459/contributions/12491/attachments/9561/13874/CHEP-2023.pdf
2023,https://indico.jlab.org/event/459/contributions/12492/,AI and Beyond: New Techniques for Simulation and Design in HEP,"Pedro Kevin, ",https://indico.jlab.org/event/459/contributions/12492/attachments/9428/13857/AI%20and%20beyond.pdf
2023,https://indico.jlab.org/event/459/contributions/11711/,The SMARTHEP European Training Network,"Jawahar Pratik, Doglioni Caterina, Gooding Jamie, ",https://indico.jlab.org/event/459/contributions/11711/attachments/9351/14001/SMARTHEPatCHEP2023.pdf
2023,https://indico.jlab.org/event/459/contributions/11729/,"Scalable, End-to-End, Machine-Learning-Based Data Reconstruction Chain for Particle Imaging Detectors","Drielsma Francois, ",https://indico.jlab.org/event/459/contributions/11729/attachments/9540/13940/CHEP2023%20ML-Based%20Reconstruction%20for%20LArTPCs.pdf
2023,https://indico.jlab.org/event/459/contributions/11591/,Unbiased detection of data departures from expectations with machine learning,"Grosso Gaia, Letizia Marco, Zanetti Marco, Wulzer Andrea, ",https://indico.jlab.org/event/459/contributions/11591/attachments/9546/13850/chep23.pdf
2023,https://indico.jlab.org/event/459/contributions/11561/,Data driven background estimation in HEP using Generative Adversarial Networks,"Lohezic Victor, Sahin Özgür, Couderc Fabrice, Malclès Julie, ",https://indico.jlab.org/event/459/contributions/11561/attachments/9506/13781/VLohezic_DataDrivenBackgroundGAN.pdf
2023,https://indico.jlab.org/event/459/contributions/11416/,Machine Learning Tools for the CMS Tracker Data Quality Monitoring and Certification,"CMS Collaboration, Benelli Gabriele, ",https://indico.jlab.org/event/459/contributions/11416/attachments/9584/13910/CMS_TRKDQMML_CHEP23_GBenelli_v2.pdf
2023,https://indico.jlab.org/event/459/contributions/11374/,AI Driven Experiment Calibration and Control,"Britton Thomas, Lawrence David, Jeske Torri, McSpadden Diana, Jarvis Naomi, ",https://indico.jlab.org/event/459/contributions/11374/attachments/9497/13764/AIEC_CHEP_2023.pdf
2023,https://indico.jlab.org/event/459/contributions/11609/,Data Centre Refurbishment with the aim of Energy Saving and Achieving Carbon Net Zero,"Traynor Daniel, Owen Richard Alex, Hays Jonathan, ",https://indico.jlab.org/event/459/contributions/11609/attachments/9396/13894/chep2023.pdf
2023,https://indico.jlab.org/event/459/contributions/11588/,Deep Learning for Matrix Element Method,"Roy Avik, Neubauer Mark, ",https://indico.jlab.org/event/459/contributions/11588/attachments/9583/13909/Deep%20Learning%20for%20the%20Matrix%20Element%20Method.pdf
2023,https://indico.jlab.org/event/459/contributions/11823/,Evaluation of ARM CPUs for IceCube available through Google Kubernetes Engine,"Sfiligoi Igor, Würthwein Frank, Schultz David, Riedel Benedikt, ",https://indico.jlab.org/event/459/contributions/11823/attachments/9228/13392/chep23_icecube_arm_rc3.pdf
2023,https://indico.jlab.org/event/459/contributions/11733/,Graph Neural Network for 3D Reconstruction in Liquid Argon Time Projection Chambers,"Hewes V, Cerati Giuseppe, Kowalkowski Jim, Aurisano Adam, Liao Wei-Keng, Lee Claire, Day Alexandra, Gumpula Kaushal, Koloskov Nikita, Koretsky Samantha, Zhang Haley, Yufei Xiao, Grzenda Daniel, Agrawal Ankit, Gray Lindsey, Klijnsma Thomas, Calafiura Paolo, Murnane Daniel, Choma Nick, Conlon Sean, Farrell Steven, Ju Xiangyang, Xu Yaoyuan, Spiropulu Maria, Vlimant Jean-Roch, ",https://indico.jlab.org/event/459/contributions/11733/attachments/9550/13855/2023-05-09%20CHEP%20talk.pdf
2023,https://indico.jlab.org/event/459/contributions/11699/,Scalable training on scalable infrastructures for programmable hardware,"Lorusso Marco, Bonacorsi Daniele, Costantini Alessandro, Duma Doina Cristina, Mariotti Mirko, Michelotto Diego, Salomoni Davide, spiga daniele, Travaglini Riccardo, Veronesi Paolo, ",https://indico.jlab.org/event/459/contributions/11699/attachments/9315/13512/CHEP2023_Slides.pdf
2023,https://indico.jlab.org/event/459/contributions/11721/,BESIII track reconstruction algorithm based on machine learning,"Jia Xiaoqian, Qin Xiaoshuai, Li Teng, HUANG Xingtao, Zhang Xueyao, Zhang Yao, Yuan Ye, ",https://indico.jlab.org/event/459/contributions/11721/attachments/9408/14067/chep2023.pdf
2023,https://indico.jlab.org/event/459/contributions/11602/,Event Generator Tuning Incorporating MC Systematic Uncertainty,"Ju Xiangyang, Schroff Jaffae, ",https://indico.jlab.org/event/459/contributions/11602/attachments/9594/13932/CHEP%202023%20MC%20Tuning%20with%20MC%20uncertainties.pdf
2023,https://indico.jlab.org/event/459/contributions/11486/,Bringing the ATLAS HammerCloud setup to the next level with containerization,"Rottler Benjamin, Boehler Michael, Lory Alexander, Mitterer Christoph Anton, Schovancova Jaroslava, ",https://indico.jlab.org/event/459/contributions/11486/attachments/9275/13449/chep_2023_hammercloud_benjamin_rottler.pdf
2023,https://indico.jlab.org/event/459/contributions/11714/,Advances in developing deep neural networks for finding primary vertices in proton-proton collisions at the LHC,"Sokoloff Michael, Akar Simon, Boettcher Thomas, Elashri Mohamed, Garg Rocky, Kauffman Elliott, Peters Michael, Sokoloff Michael, Tepe William, ",https://indico.jlab.org/event/459/contributions/11714/attachments/9420/13920/Sokoloff_Garg_CHEP-2023.pdf
2023,https://indico.jlab.org/event/459/contributions/11694/,FAIR principles for Digital Objects in High Energy Physics: A Case Study with Universal FeynRules Output (UFO) Models,"Roy Avik, Wang Zijun, Neubauer Mark, ",https://indico.jlab.org/event/459/contributions/11694/attachments/9577/13898/2023-05-09_FAIR4UFO-CHEP23.pdf
2023,https://indico.jlab.org/event/459/contributions/11382/,Triggerless data acquisition pipeline for Machine Learning based statistical anomaly detection,"Grosso Gaia, Lai Nicolò, Migliorini Matteo, Pazzini Jacopo, Triossi Andrea, Zanetti Marco, Zucchetta Alberto, ",https://indico.jlab.org/event/459/contributions/11382/attachments/9444/13693/CHEP2023_triggerlessDaqNPLM.pdf
2023,https://indico.jlab.org/event/459/contributions/11533/,Fine-Grained HEP Analysis Task Graph Optimization with Coffea and Dask,"Gray Lindsey, Smith Nick, ",https://indico.jlab.org/event/459/contributions/11533/attachments/9496/13762/CoffeaCHEP_LindseyGray_09052023.pdf
2023,https://indico.jlab.org/event/459/contributions/11739/,Uncertainty Aware Machine Learning Models for Particle Physics Applications,"Rajput Kishansingh, McSpadden Diana, Schram Malachi, Somayaji Karthik, Blokland Willem, Zhao Zhiwen, Li Peng, ",https://indico.jlab.org/event/459/contributions/11739/attachments/9521/14253/Kishan_CHEP23_UQ.pdf
2023,https://indico.jlab.org/event/459/contributions/11737/,Exploring Interpretability of Deep Neural Networks in Top Tagging,"Khot Ayush, Neubauer Mark, Roy Avik, ",https://indico.jlab.org/event/459/contributions/11737/attachments/9578/13899/2023-05-09_XAI4TopTagger-CHEP23.pdf
2023,https://indico.jlab.org/event/459/contributions/11596/,"RootInteractive tool for multidimensional statistical analysis, machine learning and analytical model validation","Ivanov Marian, Ivanov Marián, ","https://indico.jlab.org/event/459/contributions/11596/attachments/9573/13892/ATO-618%20RootInteractive%20tool%20for%20multidimensional%20statistical%20analysis,%20machine%20learning%20and%20analytical%20model%20validation.%20(2).pdf"
2023,https://indico.jlab.org/event/459/contributions/11697/,AI4EIC Hackathon: PID with the EPIC dRICH,"Suresh Karthik, Fanelli Cristiano, Suresh Karthik, Bressan Andrea, Deconinck Wouter, Diefenthaler Markus, Joosten Sylvester, Li Wenliang, Tu Zhoudunming, Osborn Joe, ",https://indico.jlab.org/event/459/contributions/11697/attachments/9649/14058/CHEP2023_AI4EIC_May9.pdf
2023,https://indico.jlab.org/event/459/contributions/11479/,"Transitioning GlideinWMS, a multi domain distributed workload manager, from GSI proxies to tokens and other granular credentials","Mambelli Marco, Coimbra Bruno, Box Denis, ",https://indico.jlab.org/event/459/contributions/11479/attachments/9600/13944/CHEP2003-GlideinWMSToken.pdf
2023,https://indico.jlab.org/event/459/contributions/11730/,Using a Neural Network to Approximate the Negative Log Likelihood Distribution,"Liu Shenghua, Jamieson Nathan, Lannon Kevin, Mohrman Kelci, Negash Sirak, Wan Yuyi, ",https://indico.jlab.org/event/459/contributions/11730/attachments/9549/13853/DNN_Likelihood_CHEP.pdf
2023,https://indico.jlab.org/event/459/contributions/11442/,A parameter optimisation toolchain for Monte Carlo detector simulation,"Volkel Benedikt, ",https://indico.jlab.org/event/459/contributions/11442/attachments/9636/14090/20230509_slides.pdf
2023,https://indico.jlab.org/event/459/contributions/11685/,Building a Global HEP Software Training Community,"Deconinck Wouter, Elmer Peter, Lieret Kilian, Malik Sudhir, Roiser Stefan, Hernandez Villanueva Michel, ",https://indico.jlab.org/event/459/contributions/11685/attachments/9665/14144/230509_hsf_training_community.pdf
2023,https://indico.jlab.org/event/459/contributions/11732/,A method for inferring signal strength modifiers by conditional invertible neural networks,"Farkas Máté Zoltán, Diekmann Svenja, Eich Niclas, Erdmann Martin, ",https://indico.jlab.org/event/459/contributions/11732/attachments/9619/13993/cINN_farkas_CHEP23.pdf
2023,https://indico.jlab.org/event/459/contributions/11669/,Apptainer Without Setuid,"Dykstra Dave, ",https://indico.jlab.org/event/459/contributions/11669/attachments/9273/13447/CHEP23_Talk_ApptainerWithoutSetuid.pdf
2023,https://indico.jlab.org/event/459/contributions/11400/,Scientific application development based on the Daisy,"Hu Yu, Liu Jianli, Sun Haokai, Liu Rui, Fu Shiyuan, Wang Lei, Wang Shuang, Qi Fazhi, Hu Qingbao, Zhao Haifeng, ",https://indico.jlab.org/event/459/contributions/11400/attachments/9523/13812/Scientific%20application%20development%20based%20on%20the%20Daisy.pptx
2023,https://indico.jlab.org/event/459/contributions/11754/,JetNet library for machine learning in high energy physics,"Kansal Raghav, Duarte Javier, Pareja Carlos, ",https://indico.jlab.org/event/459/contributions/11754/attachments/9719/14231/JetNet_CHEP.pdf
2023,https://indico.jlab.org/event/459/contributions/11720/,Artificial Intelligence and Machine Learning for EPIC: an Overview,"Fanelli Cristiano, Bressan Andrea, Diefenthaler Markus, Joosten Sylvester, Tu Zhoudunming, Osborn Joe, Li Wenliang, ",https://indico.jlab.org/event/459/contributions/11720/attachments/9721/14198/CHEP_2023_CF_ePIC.pdf
2023,https://indico.jlab.org/event/459/contributions/11746/,New developments of TMVA/SOFIE: Code Generation and Fast Inference for Graph Neural Networks,"Moneta Lorenzo, Mahamat Hamdan Ahamat, Sengupta Sanjibang, ",https://indico.jlab.org/event/459/contributions/11746/attachments/9716/14215/TMVA_SOFIE_%20CHEP23.pdf
2023,https://indico.jlab.org/event/459/contributions/11704/,Software Training Outreach In HEP,"Malik Sudhir, Elmer Peter, LaMee Adam LaMee, Cordero Danelix, Gleyzer Sergei, Cecire Ken, ",https://indico.jlab.org/event/459/contributions/11704/attachments/9690/14135/Software%20Training%20Outreach%20in%20IRISHEP-QuarkNet.pdf
2023,https://indico.jlab.org/event/459/contributions/11528/,"From prototypes to large scale detectors: how to exploit the Gaussino simulation framework for detectors studies, with a detour into machine learning","Mazurek Michał, Corti Gloria, Clemencic Marco, Morris Adam, ",https://indico.jlab.org/event/459/contributions/11528/attachments/9698/14150/CHEP_2023__From_prototypes_to_large_scale_detectors_v2.pdf
2023,https://indico.jlab.org/event/459/contributions/11619/,Results from Large-scale HPC deployment of Scalable CyberInfrastructure for Artificial Intelligence and Likelihood Free Inference (SCAILFIN),"Hildreth Michael, Hurtado Anampa Kenyi, ",https://indico.jlab.org/event/459/contributions/11619/attachments/9728/14219/SCAILFIN_CHEP_2023.pdf
2023,https://indico.jlab.org/event/459/contributions/11760/,FAIR AI Models in High Energy Physics,"Diaz Daniel, Duarte Javier, Huerta Eliu, Katz Daniel S., Kindratenko Volodymyr, Neubauer Mark, Roy Avik, zhu ruike, Li Haoyang, Mokhtar Farouk, Kansal Raghav, ",https://indico.jlab.org/event/459/contributions/11760/attachments/9724/14202/CHEP_FAIR4HEP_05112023.pdf
2023,https://indico.jlab.org/event/459/contributions/11446/,Recent Developments in the FullSimLight Simulation Tool from ATLAS,"Khan Raees, Boudreau Joseph, Bandieramonte Marilena, Bianchi Riccardo, Dell'Acqua Andrea, Tsulaia Vakho, Klekots Denys, ",https://indico.jlab.org/event/459/contributions/11446/attachments/9675/14239/CHEP2023.pdf
2023,https://indico.jlab.org/event/459/contributions/11363/,Towards a container-based architecture for CMS data acquisition,"Simelevicius Dainius, Orsini Luciano, Amoiridis Vassileios, Behrens Ulf, Bocci Andrea, Branson  James, Brummer Philipp, Cano Eric, Cittolin Sergio, Da Silva Almeida Da Quintanilha Joao, Darlea Georgiana-Lavinia, Deldicque  Christian, Dobson Marc, Gigi Dominique, Glege Frank, Gomez-Ceballos Guillelmo, Gutic Neven, Hegeman Jeroen, Izquierdo Moreno Guillermo, Kartalas Miltiadis, Krawczyk Rafal, Li Wei, Long Kenneth, Meijers Frans, Meschi Emilio, Morovic Srecko, Paus Christoph, Petrucci Andrea, Pieri Marco, Rabady Dinyar Sebastian, Racz Attila, Sakulin Hannes, Schwick Christoph, Vazquez Velez Cristina, Zejdl Petr, Zogatova Dominika, ",https://indico.jlab.org/event/459/contributions/11363/attachments/9630/14203/SimeleviciusCHEP2023.pdf
2023,https://indico.jlab.org/event/459/contributions/11740/,Symbolic Regression on FPGAs for Fast Machine Learning Inference,"Loncar Vladimir, Tsoi Ho Fung, Pol Adrian Alan, Cranmer Miles, Dasu Sridhara, Elmer Peter, Govorkova Ekaterina, Harris Philip, Ojalvo Isobel, Pierini Maurizio, ",https://indico.jlab.org/event/459/contributions/11740/attachments/9705/14164/hls4sr_chep.pdf
2023,https://indico.jlab.org/event/459/contributions/11819/,High-Throughput Machine Learning Inference with NVIDIA TensorRT,"Sclocco Alessio, Ali Suvayu, van den Oord Gijs, Cámpora Pérez Daniel, de Vries Jacco, Aaij Roel, van Veghel Maarten, ",https://indico.jlab.org/event/459/contributions/11819/attachments/9684/14125/chep2023_lhcb_gpu_tensorrt_inference_mvanveghel_v3.pdf
2023,https://indico.jlab.org/event/459/contributions/11755/,Machine Learning for Real-Time Processing of ATLAS Liquid Argon Calorimeter Signals with FPGAs,"ATLAS LAr Speaker Committee ATLAS LAr Speaker Committee, Voigt Johann, ",https://indico.jlab.org/event/459/contributions/11755/attachments/9588/13918/2023_05_11_ML_ATLAS_LAr_Johann_Voigt.pdf
2023,https://indico.jlab.org/event/459/contributions/11738/,Applications of Lipschitz neural networks to the Run 3 LHCb trigger system,"Delaney Blaise, ",https://indico.jlab.org/event/459/contributions/11738/attachments/9635/14031/Delaney_LipMonLHCb_CHEP23.pdf
2023,https://indico.jlab.org/event/459/contributions/11832/,First Measurements With A Quantum Vision Transformer: A Naive Approach,"Pasquali Dominic, Grossi Michele, Vallecorsa Sofia, ",
2023,https://indico.jlab.org/event/459/contributions/11504/,The Rubin Observatory’s Legacy Survey of Space and Time DP0.2 processing campaign at CC-IN2P3,"Le Boulc'h Quentin, Hernandez Fabio, Mainetti Gabriele, ",https://indico.jlab.org/event/459/contributions/11504/attachments/9541/13843/Rubin_processing_CC-IN2P3_CHEP%20v3.pdf
2023,https://indico.jlab.org/event/459/contributions/11751/,The Deployment of Realtime ML in Changing Environments,"Barbone Marco, Brown Christopher, Radburn-Smith Benjamin, Summer Sioni, Tapper Alexander, ",https://indico.jlab.org/event/459/contributions/11751/attachments/9710/14172/CBrown_ContinualLearning_CHEP_1105.pdf
2023,https://indico.jlab.org/event/459/contributions/11736/,Fast and Accurate Calorimeter Simulation with Diffusion Models,"Amram Oz, Pedro Kevin, ",https://indico.jlab.org/event/459/contributions/11736/attachments/9599/14176/CHEP23_CaloDiffusion.pdf
2023,https://indico.jlab.org/event/459/contributions/11756/,Improved Clustering in the Belle II Electromagnetic Calorimeter with Graph Neural Networks,"Haide Isabel, Wemmer Florian, Eppelt Jonas, Ferber Torben, ",https://indico.jlab.org/event/459/contributions/11756/attachments/9700/14154/IsabelHaide_CHEP_Talk_110523.pdf
2023,https://indico.jlab.org/event/459/contributions/11837/,Improving Noisy Hybrid Quantum Graph Neural Networks for Particle Decay Tree Reconstruction,"Strobl Melvin, Kuehn Eileen, Fischer Max, Streit Achim, ",https://indico.jlab.org/event/459/contributions/11837/attachments/9417/13658/chep23-ms.pdf
2023,https://indico.jlab.org/event/459/contributions/11638/,"Management of Batch worker node lifecycle and maintenance at CERN with BrainSlug (our in-house state-manager daemon), Rundeck and StackStorm","Singh Ankur, Jones Ben, Khandelwal Priyanshu, Alvarez Luis, ",https://indico.jlab.org/event/459/contributions/11638/attachments/9708/14174/chep23_stackstorm.pptx
2023,https://indico.jlab.org/event/459/contributions/11460/,Potentiality of automatic parameter tuning suite available in ACTS track reconstruction software framework,"Garg Rocky Bala, Salzburger Andreas, Allaire Corentin, Tompkins Lauren, Grasland Hadrien, Hofgard Elyssa Frances, Garg rocky, ",https://indico.jlab.org/event/459/contributions/11460/attachments/9713/14178/CHEP2023_ACTS_opti_RBG.pdf
2023,https://indico.jlab.org/event/459/contributions/11725/,Refining fast simulation using machine learning,"Bein Samuel, Connor Patrick, Pedro Kevin, Schleper Peter, Wolf Moritz, ",https://indico.jlab.org/event/459/contributions/11725/attachments/9653/14070/20230511chep_MoritzWolf_Refinement_v2.pdf
2023,https://indico.jlab.org/event/459/contributions/11831/,Symmetry Invariant Quantum Machine Learning models for classification problems in Particle Physics,"Heredge Jamie, Creevey Floyd, Hollenberg Lloyd, Sevior Martin, ",https://indico.jlab.org/event/459/contributions/11831/attachments/9662/14084/Symmetery_Invariant_CHEP_Jamie_Heredge.pdf
