Year,Link,Title,Authors,Attachment
2019,https://indico.cern.ch/event/773049/contributions/3473787/,Machine Learning-based Anomaly Detection of Ganglia Monitoring data in HEP Data Center,"juan chen, Juan Chen, juan chen, Lu Wang, Qingbao Hu, ",https://indico.cern.ch/event/773049/contributions/3473787/attachments/1937489/3211311/chep2019_chenjuan.pdf
2019,https://indico.cern.ch/event/773049/contributions/3473797/,Anomaly detection using Unsupervised Machine Learning for Grid computing site operation,"Tomoe Kishimoto, Junichi Tanaka, Tetsuro Mashimo, Ryu Sawada, Koji Terashi, Michiru Kaneda, Masahiko Saito, Nagataka Matsui, ",https://indico.cern.ch/event/773049/contributions/3473797/attachments/1937447/3211190/Tomoe_CHEP2019.pdf
2019,https://indico.cern.ch/event/773049/contributions/3474811/,Large-scale HPC deployment of Scalable CyberInfrastructure for Artificial Intelligence and Likelihood Free Inference (SCAILFIN),"Mike Hildreth, Kenyi Paolo Hurtado Anampa, Cody Kankel, Scott Hampton, Paul Brenner, Irena Johnson, Tibor Simko, ",https://indico.cern.ch/event/773049/contributions/3474811/attachments/1937545/3211429/CHEP_2019_Hildreth.pdf
2019,https://indico.cern.ch/event/773049/contributions/3476171/,Machine Learning with ROOT/TMVA,"Lorenzo Moneta, Kim Albertsson, Sitong An, Stefan Wunsch, Sergei Gleyzer, Omar Andres Zapata Mesa, ",https://indico.cern.ch/event/773049/contributions/3476171/attachments/1936050/3208338/CHEP_2019__Machine_Learning_with_ROOT_TMVA.pdf
2019,https://indico.cern.ch/event/773049/contributions/3476172/,"Evolution of web-based analysis for Machine Learning and LHC Experiments: power of integrating storage, interactivity and collaboration with JupyterLab in SWAN","Diogo Castro, Jakub Moscicki, Enrico Bocchi, Enric Tejedor Saavedra, Danilo Piparo, Pere Mato Vila, Prasanth Kothuri, Piotr Mrowczynski, ",https://indico.cern.ch/event/773049/contributions/3476172/attachments/1937733/3211862/SWAN-CHEP2019.pdf
2019,https://indico.cern.ch/event/773049/contributions/3474759/,A deep neural network method for analyzing the CMS High Granularity Calorimeter (HGCAL) events,"Gilles Grasseau, Abhinav Kumar, Andrea Sartirana, Artur Lobanov, Florian Beaudette, Pierre Ouannes, ",https://indico.cern.ch/event/773049/contributions/3474759/attachments/1935965/3211524/CHEP-19-HGCAL2D-v2.pdf
2019,https://indico.cern.ch/event/773049/contributions/3476191/,The F.A.S.T. toolset: Using YAML to make tables out of trees,"Benjamin Krikler, Lukasz Kreczko, Olivier Davignon, Jacob Thomas Linacre, ",https://indico.cern.ch/event/773049/contributions/3476191/attachments/1937639/3211616/191104__The_FAST-HEP_toolkit__CHEP19-1.pdf
2019,https://indico.cern.ch/event/773049/contributions/3474830/,Deep Learning for HEP on HPC at NERSC,"Wahid Bhimji, Steven Farrell, Mustafa Mustafa, ",https://indico.cern.ch/event/773049/contributions/3474830/attachments/1935970/3211748/CHEP2019-NERSC-DL.pdf
2019,https://indico.cern.ch/event/773049/contributions/3474855/,Delivering a machine learning course on HPC resources,"Federica Legger, Stefano Bagnasco, Stefano Lusso, Gabriele Gaetano Fronze', Sara Vallero, ",https://indico.cern.ch/event/773049/contributions/3474855/attachments/1937729/3211817/CHEP19_-_ML_course.pdf
2019,https://indico.cern.ch/event/773049/contributions/3474762/,Particle shower simulation in high granularity calorimeters using 3 dimensional convolutional Generative Adversarial Networks,"Federico Carminati, Gul Rukh Khattak, Sofia Vallecorsa, ",https://indico.cern.ch/event/773049/contributions/3474762/attachments/1937793/3211928/GANsimulation_T2_draft0.pdf
2019,https://indico.cern.ch/event/773049/contributions/3474808/,Enabling ATLAS big data processing on Piz Daint at CSCS,"Francesco Giovanni Sciacca, Michele Weber, ",https://indico.cern.ch/event/773049/contributions/3474808/attachments/1937738/3211831/ATLAS-Daint-CHEP2019.pdf
2019,https://indico.cern.ch/event/773049/contributions/3474741/,Generative Adversarial Networks for LHCb Fast Simulation,"Denis Derkach, Fedor Ratnikov, ",https://indico.cern.ch/event/773049/contributions/3474741/attachments/1937484/3216167/GAN_FastsimLHCb_CHEP_191104_v2.pdf
2019,https://indico.cern.ch/event/773049/contributions/3474723/,Generation of Belle II pixel detector background data with a GAN,"Matej Srebre, Pascal Schmolz, Martin Ritter, Thomas Kuhr, Hosein Hashemi, ",https://indico.cern.ch/event/773049/contributions/3474723/attachments/1937473/3211247/BelleII_GAN.pdf
2019,https://indico.cern.ch/event/773049/contributions/3474799/,MPI-based tools for large-scale training and optimization at HPC sites,"Vladimir Loncar, Jean-Roch Vlimant, Sofia Vallecorsa, Gul Rukh Khattak, Maurizio Pierini, Thong Nguyen, Federico Carminati, ",https://indico.cern.ch/event/773049/contributions/3474799/attachments/1937869/3212749/NNLO_-_CHEP2019.pdf
2019,https://indico.cern.ch/event/773049/contributions/3473817/,The SIMPLE Framework for deploying containerized grid services,"Mayank Sharma, Maarten Litmaath, Eraldo Silva Junior, Renato Santana, Julia Andreeva, ",https://indico.cern.ch/event/773049/contributions/3473817/attachments/1937788/3213508/SIMPLE-16-9-CHEP-2019-v6.pdf
2019,https://indico.cern.ch/event/773049/contributions/3474823/,3D Generative Adversarial Networks inference implementation on FPGAs,"Chao Jiang, Herman Lam, Dave Ojika, Federico Carminati, Gul Rukh Khattak, Sofia Vallecorsa, Francisco Perez, Shawn Slocker, ",https://indico.cern.ch/event/773049/contributions/3474823/attachments/1937746/3213602/3DGAN_FPGA_T9.pdf
2019,https://indico.cern.ch/event/773049/contributions/3473375/,Nordugrid ARC cache: Efficiency gains on HPC and cloud resources,"Maiken Pedersen, Balazs Konya, ",https://indico.cern.ch/event/773049/contributions/3473375/attachments/1934665/3220528/Maiken_Pedersen_CHEP-2019.pdf
2019,https://indico.cern.ch/event/773049/contributions/3474731/,FPGA-accelerated machine learning inference as a service for particle physics computing,"Nhan Viet Tran, Kevin Pedro, ",https://indico.cern.ch/event/773049/contributions/3474731/attachments/1937540/3211866/sonic_CHEP2019.pdf
2019,https://indico.cern.ch/event/773049/contributions/3474407/,Smart caching at CMS: applying AI to XCache edge services,"CMS Collaboration, ",https://indico.cern.ch/event/773049/contributions/3474407/attachments/1938665/3213635/CHEP2019-cache-spiga.pdf
2019,https://indico.cern.ch/event/773049/contributions/3474338/,An express data production chain in the STAR experiment,"Ivan Kisel, Artemiy Belousov, Yuri Fisyak, Hongwei Ke, Pavel Kisel, Grigory Kozlov, Spyridon Margetis, Aihong Tang, Iouri Vassiliev, Maksym Zyzak, ",https://indico.cern.ch/event/773049/contributions/3474338/attachments/1937829/3218988/Kisel_STAR_CHEP-2019.pdf
2019,https://indico.cern.ch/event/773049/contributions/3474736/,FullSimLight: ATLAS standalone Geant4 simulation,"Marilena Bandieramonte, Riccardo Maria Bianchi, Joseph Boudreau, ",https://indico.cern.ch/event/773049/contributions/3474736/attachments/1938239/3212741/FullSimLight_MBandieramonte_CHEP2019.pdf
2019,https://indico.cern.ch/event/773049/contributions/3474397/,Moving the California distributed CMS xcache from bare metal into containers using Kubernetes,"CMS Collaboration, Edgar Fajardo Hernandez, Matevz Tadel, ",https://indico.cern.ch/event/773049/contributions/3474397/attachments/1937811/3211960/CMS_Kubernetes_CHEP_2019.pdf
2019,https://indico.cern.ch/event/773049/contributions/3473243/,Sustainable software packaging for end users with conda,"Chris Burr, Henry Fredrick Schreiner, Enrico Guiraud, Javier Cervantes Villanueva, Ben Couturier, ",https://indico.cern.ch/event/773049/contributions/3473243/attachments/1938659/3213612/2019-11-05_CHEP2019-conda.pdf
2019,https://indico.cern.ch/event/773049/contributions/3474831/,The Tracking Machine Learning Challenge,"David Rousseau, Jean-Roch Vlimant, Vincenzo Innocente, Andreas Salzburger, Isabelle Guyon, Sabrina Amrouche, Tobias Golling, Moritz Kiehn, Yetkin Yilmaz, Paolo Calafiura, Steven Farrell, Heather Gray, Vladimir Gligorov, Laurent Basara, Victor Estrade, Cecile Germain, Edward Moyse, Mikhail Hushchyn, Andrey Ustyuzhanin, ",https://indico.cern.ch/event/773049/contributions/3474831/attachments/1938609/3213492/vlimant_CHEP19_TrackML_Nov19.pdf
2019,https://indico.cern.ch/event/773049/contributions/3474783/,End-to-end Deep Learning Fast Simulation Framework,"Ioana Ifrim, Witold Pokorski, Anna Zaborowska, ",https://indico.cern.ch/event/773049/contributions/3474783/attachments/1936866/3210088/End_to_End_Deep_Learning_FastSim_Framework_Poster_Ioana_Ifrim.pdf
2019,https://indico.cern.ch/event/773049/contributions/3473855/,Erratic server behavior detection using machine learning on streams of monitoring data,"Martin Adam, Luca Magnoni, Dagmar Adamova, Martin Pilát, ",https://indico.cern.ch/event/773049/contributions/3473855/attachments/1936223/3208679/poster.pdf
2019,https://indico.cern.ch/event/773049/contributions/3474784/,Generative Adversarial Network for Background Generation in the KLM subsystem at Belle II,"Leo Piilonen, ",
2019,https://indico.cern.ch/event/773049/contributions/3476052/,Machine Learning Pipelines for HEP Using Big Data Tools Applied to Improving Event Filtering,"Marco Zanetti, Matteo Migliorini, Luca Canali, ",
2019,https://indico.cern.ch/event/773049/contributions/3473850/,Standalone containers with ATLAS offline software,"Marcelo Vogel, Alessandra Forti, Lukas Alexander Heinrich, Misha Borodin, ",https://indico.cern.ch/event/773049/contributions/3473850/attachments/1935983/3341043/ATL-SOFT-SLIDE-2019-770.pdf
2019,https://indico.cern.ch/event/773049/contributions/3474771/,Using ML to Speed Up New and Upgrade Detector Studies,"Fedor Ratnikov, Denis Derkach, Alexey Boldyrev, ",https://indico.cern.ch/event/773049/contributions/3474771/attachments/1937486/3211299/ML_Upgrade_Poster.pdf
2019,https://indico.cern.ch/event/773049/contributions/3476055/,Utilizing Machine Learning In BSM Physics Searches At The LHC,"Adam Leinweber, Riley Patrick, Martin John White, ",https://indico.cern.ch/event/773049/contributions/3476055/attachments/1936870/3211995/CHEP_Presentation.pdf
2019,https://indico.cern.ch/event/773049/contributions/3473816/,Deployment of containers on the diverse ATLAS infrastructure,"Alessandra Forti, Andrej Filipcic, Lukas Alexander Heinrich, Asoka De Silva, Paul Nilsson, Alessandro De Salvo, Alexander Bogdanchikov, Peter Love, Sergey Panitkin, Doug Benjamin, Wei Yang, ",https://indico.cern.ch/event/773049/contributions/3473816/attachments/1932946/3202089/ATL-SOFT-SLIDE-2019-798.pdf
2019,https://indico.cern.ch/event/773049/contributions/3476058/,ML Track Fitting in Nuclear Physics,"David Lawrence, Gagik Gavalian, Thomas Britton, ",https://indico.cern.ch/event/773049/contributions/3476058/attachments/1936797/3209877/CHEP_2019_AI_tracking.pdf
2019,https://indico.cern.ch/event/773049/contributions/3473257/,Assessing Software Defect Prediction on WLCG Software: a Study with Unlabelled Datasets and Machine Learning Techniques,"Elisabetta Ronchieri, Marco Canaparo, Davide Salomoni, Barbara Martelli, ",https://indico.cern.ch/event/773049/contributions/3473257/attachments/1934414/3213580/chep19-assessing-sw-v6.pdf
2019,https://indico.cern.ch/event/773049/contributions/3476070/,Reinforcement learning for sorting jets in top pair associated Higgs boson production,"Benjamin Fischer, Dennis Noll, Martin Erdmann, ",https://indico.cern.ch/event/773049/contributions/3476070/attachments/1937569/3213774/chep19_noll_reinforced_sorting.pdf
2019,https://indico.cern.ch/event/773049/contributions/3473819/,"Science Box: Converging to Kubernetes containers in production for on-premise and hybrid clouds for CERNBox, SWAN, and EOS","Enrico Bocchi, Hugo Gonzalez Labrador, Diogo Castro, Jakub Moscicki, Prasanth Kothuri, Luca Canali, Piotr Mrowczynski, Maciej Malawski, ",https://indico.cern.ch/event/773049/contributions/3473819/attachments/1936794/3213824/sciencebox.pdf
2019,https://indico.cern.ch/event/773049/contributions/3474410/,Data migration strategy based on file heat prediction with deep learning methods,"Shiyuan Fu, Zhenjing Cheng, Lu Wang, Yaodong Cheng, Gang CHEN, Qingbao Hu, Haibo li, Shiyuan Fu, Shiyuan Fu, ",https://indico.cern.ch/event/773049/contributions/3474410/attachments/1937885/3213776/Data_Migration_Strategy_for_High_Energy_Physics_Storage_Systems.pdf
2019,https://indico.cern.ch/event/773049/contributions/3476071/,Identification of new long-lived particle states using deep neural networks,"Matthias Komm, ",https://indico.cern.ch/event/773049/contributions/3476071/attachments/1937725/3211803/pres.pdf
2019,https://indico.cern.ch/event/773049/contributions/3473827/,Abstracting container technologies and transfer mechanisms in the Scalable CyberInfrastructure for Artificial Intelligence and Likelihood Free Inference (SCAILFIN) project,"Mike Hildreth, Kenyi Paolo Hurtado Anampa, Tibor Simko, Paul Brenner, Scott Hampton, Cody Kankel, Irena Johnson, ",https://indico.cern.ch/event/773049/contributions/3473827/attachments/1938702/3213719/SCAILFIN_CHEP2019.pdf
2019,https://indico.cern.ch/event/773049/contributions/3476144/,Physics Inspired Deep Neural Networks for Top Quark Reconstruction,"Kevin Greif, Kevin Patrick Lannon, ",https://indico.cern.ch/event/773049/contributions/3476144/attachments/1937548/3211432/kgreif_lnn_final.pdf
2019,https://indico.cern.ch/event/773049/contributions/3474329/,Track reconstruction with PANDA at FAIR,"Michael Papenbrock, Walter Ikegami Andersson, Jenny Regina, ",https://indico.cern.ch/event/773049/contributions/3474329/attachments/1931588/3208900/Track_Reconstruction_at_PANDA.pdf
2019,https://indico.cern.ch/event/773049/contributions/3476046/,Machine learning for QCD theory and data analysis,"nobuo sato, Nobuo Sato, nobuo sato, Wally Melnitchouk, ",https://indico.cern.ch/event/773049/contributions/3476046/attachments/1938604/3213472/slides.pdf
2019,https://indico.cern.ch/event/773049/contributions/3473829/,Running ALICE Grid Jobs in Containers - A new approach to job execution for the next generation ALICE Grid framework,"Maksim Melnik Storetvedt, ",https://indico.cern.ch/event/773049/contributions/3473829/attachments/1938684/3213682/T7_CHEP2019.pdf
2019,https://indico.cern.ch/event/773049/contributions/3474862/,The IPPOG Resource Database - Making Particle Physics Outreach & Education Available Worldwide,"Marzena Lapka, Steven Goldfarb, ",https://indico.cern.ch/event/773049/contributions/3474862/attachments/1938228/3212918/IPPOG_database_CHEP2019_MLapka.pdf
2019,https://indico.cern.ch/event/773049/contributions/3581371/,HPC+AI: Accelerating scientific computing for the Exascale era,"Jeff Adie, ",https://indico.cern.ch/event/773049/contributions/3581371/attachments/1939863/3215975/CHEP2019_JA.pdf
2019,https://indico.cern.ch/event/773049/contributions/3476179/,Constraining effective field theories with machine learning,"Johann Brehmer, Kyle Stuart Cranmer, Gilles Louppe, Juan Guillermo Pavez Sepulveda, Alexander Held, ",https://indico.cern.ch/event/773049/contributions/3476179/attachments/1939681/3215626/20191107_Constraining_EFTs_with_ML.pdf
2019,https://indico.cern.ch/event/773049/contributions/3474837/,User documentation and training at Belle II,"Francesco Tenchini, Ilya Komarov, Martin Ritter, Sam Cunliffe, Thomas Kuhr, ",https://indico.cern.ch/event/773049/contributions/3474837/attachments/1939712/3215708/Slides_for_the_talk.pdf
2019,https://indico.cern.ch/event/773049/contributions/3474846/,Enabling HEP software development for the 2020s - a coherent vision for training,"Sudhir Malik, Peter Elmer, David Lange, Ian Cosden, ",https://indico.cern.ch/event/773049/contributions/3474846/attachments/1940542/3217448/CHEP2019-training.pdf
2019,https://indico.cern.ch/event/773049/contributions/3474809/,"Large scale fine grain simulation workflows (""Jumbo Jobs"") on HPC's by the ATLAS experiment","Doug Benjamin, Wen Guan, Tadashi Maeno, Nicolo Magini, Paul Nilsson, Danila Oleynik, Vakho Tsulaia, Taylor Childers, Martina Javurkova, ",https://indico.cern.ch/event/773049/contributions/3474809/attachments/1935312/3206972/ATL-COM-SOFT-2019-103.pdf
2019,https://indico.cern.ch/event/773049/contributions/3474848/,Email-based threats - addressing the human factor,"Sebastian Lopienski, ",https://indico.cern.ch/event/773049/contributions/3474848/attachments/1937451/3215743/2019.11_CHEP_-_mail_security_human_aspects_v3.pdf
2019,https://indico.cern.ch/event/773049/contributions/3473810/,High-availability on-site deployment to heterogeneous architectures for Project 8 and ADMX,"Benjamin LaRoque, ",https://indico.cern.ch/event/773049/contributions/3473810/attachments/1937322/3210953/CHEP2019_LaRoque_availability_and_architectures.pdf
2019,https://indico.cern.ch/event/773049/contributions/3474748/,Mikado approach for the TrackML Particle Tracking Challenge,"Sergey Gorbunov, ",https://indico.cern.ch/event/773049/contributions/3474748/attachments/1939687/3215639/Gorbunov-CHEP2019-MikadoTracker.pdf
2019,https://indico.cern.ch/event/773049/contributions/3473254/,PODIO: recent developments in the Plain Old Data EDM toolkit,"Frank-Dieter Gaede, Graeme A Stewart, Benedikt Hegner, ",https://indico.cern.ch/event/773049/contributions/3473254/attachments/1939721/3215730/gaede_podio_chep19.pdf
2019,https://indico.cern.ch/event/773049/contributions/3474319/,"Highly Performant, Deep Neural Networks with sub-microsecond latency on FPGAs for Trigger Applications","Christian Schmitt, Christian Kahra, ",https://indico.cern.ch/event/773049/contributions/3474319/attachments/1939652/3215560/2019_11_07_CHEP.pdf
2019,https://indico.cern.ch/event/773049/contributions/3476165/,CERN analysis preservation and reuse framework: FAIR research data services for LHC experiments,"Anna Trzcinska, Artemis Lavasa, Diego Rodriguez Rodriguez, Jan Okraska, Pamfilos Fokianos, Rokas Maciulaitis, Sebastian Stefan Feger, Stephanie Van De Sandt, Tibor Simko, ",https://indico.cern.ch/event/773049/contributions/3476165/attachments/1939908/3216047/CAP-CHEP2019.pdf
2019,https://indico.cern.ch/event/773049/contributions/3474297/,hls4ml: deploying deep learning on FPGAs for L1 trigger and Data Acquisition,"Nhan Viet Tran, Vladimir Loncar, ",https://indico.cern.ch/event/773049/contributions/3474297/attachments/1940546/3217477/hls4ml_-_CHEP2019.pdf
2019,https://indico.cern.ch/event/773049/contributions/3473256/,mesh2gdml: Importing CAD and meshed geometries into Geant4,"Norman Anthony Graf, ",https://indico.cern.ch/event/773049/contributions/3473256/attachments/1935968/3217396/mesh2gdml_CHEP2019_Graf.pdf
2019,https://indico.cern.ch/event/773049/contributions/3474321/,Mass storage interface LTSM for FAIR Phase 0 data acquisition,"Joern Adamczewski-Musch, Thomas Stibor, ",https://indico.cern.ch/event/773049/contributions/3474321/attachments/1932928/3202052/LTSM_AdamczewskiMusch2.pdf
2019,https://indico.cern.ch/event/773049/contributions/3473376/,Exploiting CRIC to streamline the configuration management of glideinWMS factories for CMS support,"CMS Collaboration, ",https://indico.cern.ch/event/773049/contributions/3473376/attachments/1939695/3217389/CMS-CHEP-CRIC.pdf
2019,https://indico.cern.ch/event/773049/contributions/3474728/,BESIII drift chamber tracking with machine learning,"Yao Zhang, Ye Yuan, Qiumei Ma, ",https://indico.cern.ch/event/773049/contributions/3474728/attachments/1936045/3208331/CHEP2019_MDC_MT_tracking.pdf
2019,https://indico.cern.ch/event/773049/contributions/3473846/,ComputeOps: container for High Performance Computing,"Cecile Cavet, David Chamont, Martin Souchal, Andrea Sartirana, Jerome Pansanel, Emmanuel Medernach, Victor Mendoza, Olivier Dadoun, Gérard Marchal-Duval, Aurélien Bailly-Reyre, Sébastien Gadrat, Rémy Dernat, Alexandre Dehne-Garcia, Richard RANDRIATOAMANANA, Gilles Grasseau, Violaine Louvet, ",https://indico.cern.ch/event/773049/contributions/3473846/attachments/1936145/3208526/poster_chep_19.pdf
2019,https://indico.cern.ch/event/773049/contributions/3476168/,Fast Inference for Machine Learning in ROOT/TMVA,"Kim Albertsson, Lorenzo Moneta, Sitong An, Stefan Wunsch, ",https://indico.cern.ch/event/773049/contributions/3476168/attachments/1937600/3211545/TMVA_Fast_Inference_Poster.pdf
2019,https://indico.cern.ch/event/773049/contributions/3473319/,Knowledge sharing on deep learning in physics research using VISPA,"Alexander Temme, Benjamin Fischer, Dennis Noll, Katharina Hafner, Manfred Peter Fackeldey, Marcel Rieger, Martin Erdmann, Martin Urban, Max Beer, Max Vieweg, Niclas Eich, Yannik Alexander Rath, ",https://indico.cern.ch/event/773049/contributions/3473319/attachments/1937589/3211520/VISPA_CHEP_POSTER.pdf
2019,https://indico.cern.ch/event/773049/contributions/3476064/,The use of Convolutional Neural Networks for signal-background classification in Particle Physics experiments,"Venkitesh Ayyar, Wahid Bhimji, Prabhat, Spencer Klein, Sally Robertson, Nick Choma, Tomasz Palczewski, Zahra Ronaghi, Lisa Gerhardt, ",https://indico.cern.ch/event/773049/contributions/3476064/attachments/1933634/3203558/ML_CHEP_poster.pdf
2019,https://indico.cern.ch/event/773049/contributions/3581349/,"Track 4 Highlights – Data Organisation, Management and Access","Tigran Mkrtchyan, Tigran Mkrtchyan, Tigran Mkrtchyan, ",https://indico.cern.ch/event/773049/contributions/3581349/attachments/1941289/3218916/T4-Highlights.pdf
2019,https://indico.cern.ch/event/773049/contributions/3581352/,"Track 7 Highlights – Facilities, Clouds and Containers","Christoph Wissing, ",https://indico.cern.ch/event/773049/contributions/3581352/attachments/1941215/3218740/T7-Highlights.pdf
2019,https://indico.cern.ch/event/773049/contributions/3581353/,"Track 8 Highlights – Collaboration, Education, Training and Outreach","Marzena Lapka, ",https://indico.cern.ch/event/773049/contributions/3581353/attachments/1941277/3218934/Track_8_MarzenaLapka.pdf
2018,https://indico.cern.ch/event/587955/contributions/2938082/,ALFA: ALICE-FAIR new message queuing based framework,"Mohammad Al-Turany, Alexey Rybalchenko, Dennis Klein, Thorsten Kollegger, Andrey Lebedev, Anar Manafov, Radoslaw Karabowicz, Florian Uhlig, Dmytro Kresan, ",https://indico.cern.ch/event/587955/contributions/2938082/attachments/1673468/2705157/ALFA_CHEP_2018.pptx
2018,https://indico.cern.ch/event/587955/contributions/2937512/,Partnering with industry for machine learning at HL-LHC,"Maria Girone, ",https://indico.cern.ch/event/587955/contributions/2937512/attachments/1683065/2705991/CHEP18_Girone.pdf
2018,https://indico.cern.ch/event/587955/contributions/2937501/,New Machine Learning Developments in ROOT/TMVA,"Lorenzo Moneta, Omar Andres Zapata Mesa, Sergei Gleyzer, Vladimir Ilievski, Kim Albertsson, Stefan Wunsch, Saurav Shekhar, Akshay Vashistha, Marc Huwiler, ",https://indico.cern.ch/event/587955/contributions/2937501/attachments/1678682/2705216/tmva-chep2018.pdf
2018,https://indico.cern.ch/event/587955/contributions/2937595/,A Machine Learning tool for fast simulation,"Federico Carminati, Gul Rukh Khattak, Sofia Vallecorsa, ",https://indico.cern.ch/event/587955/contributions/2937595/attachments/1683315/2705533/GANsimulation_Vallecorsa.pdf
2018,https://indico.cern.ch/event/587955/contributions/2937563/,"Interactive, scalable, reproducible data analysis with containers, Jupyter, and Parsl","Yadu Babuji, Kyle Chard, Ian Foster, Daniel S. Katz, Michael Wilde, Anna Elizabeth Woodard, Justin M. Wozniak, ",https://indico.cern.ch/event/587955/contributions/2937563/attachments/1683321/2707679/2018-07-09_CHEP_Parsl.pdf
2018,https://indico.cern.ch/event/587955/contributions/2937538/,Study of Neural Network Size Requirements for Approximating Functions Relevant to HEP,"Kevin Patrick Lannon, Jessica Stietzel, ",https://indico.cern.ch/event/587955/contributions/2937538/attachments/1679311/2705153/CHEP_pres.pdf
2018,https://indico.cern.ch/event/587955/contributions/2938096/,Software training for the next generation of Physicists: joint experience of LHCb and ALICE,"Chris Burr, Dario Berzano, Redmer Alexander Bertens, Albert Puig Navarro, Chris Burr, Violaine Bellee, ",https://indico.cern.ch/event/587955/contributions/2938096/attachments/1678925/2704961/20180709_-_CHEP2018_-_Software_training_for_the_next_generation_of_physicists_-_joint_experience_of_LHCb_and_ALICE.pdf
2018,https://indico.cern.ch/event/587955/contributions/2937523/,Anomaly detection using Deep Autoencoders for the assessment of the quality of the data acquired by the CMS experiment,"Gianluca Cerminara, Giovanni Franzoni, Federico De Guio, Adrian Alan Pol, Filip Siroky, Virginia Azzolini, Maurizio Pierini, Jean-Roch Vlimant, ",https://indico.cern.ch/event/587955/contributions/2937523/attachments/1683227/2705308/chep-offline.pdf
2018,https://indico.cern.ch/event/587955/contributions/2938059/,Exploring polyglot software frameworks in ALICE with FairMQ and fer,"Sebastien Binet, Laurent Aphecetche, ",https://indico.cern.ch/event/587955/contributions/2938059/attachments/1676503/2691778/2018-07-09-chep-alice-fer.pdf
2018,https://indico.cern.ch/event/587955/contributions/2937622/,FairRoot and ALICE O2 multithreading simulation,"Ivana Hrivnacova, ",https://indico.cern.ch/event/587955/contributions/2937622/attachments/1679275/2705182/hrivnacova-chep18-380_v2.pdf
2018,https://indico.cern.ch/event/587955/contributions/2937517/,"Online detector monitoring using AI: challenges, prototypes and performance evaluation for automation of online quality monitoring of the CMS experiment exploiting machine learning algorithms.","Adrian Alan Pol, Maurizio Pierini, Gianluca Cerminara, Cecile Germain, Giovanni Franzoni, Filip Siroky, ",https://indico.cern.ch/event/587955/contributions/2937517/attachments/1683228/2705309/chep-online.pdf
